<?xml version="1.0" encoding="UTF-8"?>
<!--Sample XML file generated by XMLSpy v2020 rel. 2 (x64) (http://www.altova.com)-->
<n1:TransStatusOrAckResponse xmlns:n1="urn:us:gov:treasury:irs:ir" xmlns:xsi="http://www.w3.org/2001/XMLSchema-instance" xsi:schemaLocation="urn:us:gov:treasury:irs:ir IRS-IR-TransStatusOrAckResponse.xsd">
	<n1:ResultGrp>
		<n1:SearchId>550e8400-e29b-41d4-a716-446655440000:IRIS:BB002::A</n1:SearchId>
		<n1:TransmissionResultGrp>
			<n1:ReceiptId>2020-63385508791-4a6c57eda</n1:ReceiptId>
			<n1:TransmissionStatusCd>Accepted with Errors</n1:TransmissionStatusCd>
		</n1:TransmissionResultGrp>
	</n1:ResultGrp>
	<n1:ResultGrp>
		<n1:SearchId>8400550f-f35b-21r3-4b22-123123123199:IRIS:BB002::A</n1:SearchId>
		<n1:TransmissionResultGrp>
			<n1:TransmissionStatusCd>Processing</n1:TransmissionStatusCd>
		</n1:TransmissionResultGrp>
	</n1:ResultGrp>
</n1:TransStatusOrAckResponse>
