<?xml version="1.0" encoding="UTF-8"?>
<!--Sample XML file generated by XMLSpy v2021 rel. 3 (x64) (http://www.altova.com)-->
<n1:TransStatusOrAckResponse xmlns:n1="urn:us:gov:treasury:irs:ir" xmlns:xsi="http://www.w3.org/2001/XMLSchema-instance" xsi:schemaLocation="urn:us:gov:treasury:irs:ir IRS-IR-TransStatusOrAckResponse.xsd">
	<n1:ResultGrp>
		<n1:SearchId>2020-63385508791-4a6c57eda</n1:SearchId>
		<n1:TransmissionResultGrp>
			<n1:UniqueTransmissionId>550e8400-e29b-41d4-a716-446655440000:IRIS:BB002::A</n1:UniqueTransmissionId>
			<n1:TransmissionStatusCd>Accepted</n1:TransmissionStatusCd>
		</n1:TransmissionResultGrp>
		<n1:SubmissionResultGrp>
			<n1:SubmissionId>1</n1:SubmissionId>
			<n1:SubmissionStatusCd>Accepted with Errors</n1:SubmissionStatusCd>
			<n1:RecordResultGrp>
				<n1:RecordId>1</n1:RecordId>
				<n1:ErrorInformationGrp>
					<n1:ErrorMessageCd>String</n1:ErrorMessageCd>
					<n1:ErrorMessageTxt>String</n1:ErrorMessageTxt>
					<n1:ErrorValueTxt>String</n1:ErrorValueTxt>
					<n1:ElementPathTxt>String</n1:ElementPathTxt>
				</n1:ErrorInformationGrp>
			</n1:RecordResultGrp>
		</n1:SubmissionResultGrp>
	</n1:ResultGrp>
	<n1:ResultGrp>
		<n1:SearchId>2020-63385508791-4a6c57edb</n1:SearchId>
		<n1:TransmissionResultGrp>
			<n1:TransmissionStatusCd>Not Found</n1:TransmissionStatusCd>
			<n1:ErrorInformationGrp>
					<n1:ErrorMessageCd>String</n1:ErrorMessageCd>
					<n1:ErrorMessageTxt>String</n1:ErrorMessageTxt>
					<n1:ErrorValueTxt>String</n1:ErrorValueTxt>
					<n1:ElementPathTxt>String</n1:ElementPathTxt>
				</n1:ErrorInformationGrp>
		</n1:TransmissionResultGrp>
	</n1:ResultGrp>
</n1:TransStatusOrAckResponse>
